commit	gen_speed	accuracy	status	description
6f3e16b	5.85	69.82	keep	initial port: on-device encoder+heads (LoFi bfloat8_b), host softmax+norm+nms; score PCC 0.698 (pre-NMS), desc PCC 0.979
-	0.00	0.0	crash	device 3 ARC core (8,0) wedged — tt-smi -r 3 re-init fails persistently; luwen reset also fails; requires hardware power-cycle or admin intervention
b0ecf6a	6.41	99.72	keep	encoder+heads precision to HiFi2/bfloat16-weights/fp32-acc — +9.6% speed AND pre-NMS PCC 0.997 score / 0.999 desc (meets 99% target)
1448e41	6.46	90.99	discard	encoder weights → bfloat8_b (+fp32 acc HiFi2) — score PCC 0.91 < 99%, reverted
0293b09	6.40	99.72	keep	reduce DRAM slice counts (8,4,2,1)→(4,2,1,1) — speed parity, simpler config
a828c8a0fc	6.36	99.72	discard	deallocate_activation=True on convs — marginal regression, no benefit at this model size
1c2a582945	6.59	99.72	keep	move descriptor L2-normalize to device — +2.9% speed, PCC unchanged
e37ebc7bfa	0.00	0.00	crash	DRAM slices (2,1,1,1) — block0/1 exceeds L1 (1.58MB>1.57MB limit)
7ce44b087a	6.26	99.72	discard	slices (4,1,1,1) — block 1 L1-full slower than 2-slice DRAM
f7bbfbe61b	6.22	99.72	discard	enable conv weights double-buffering — slower (tighter CBs at block 0)
5a705bdb6c	71.31	99.72	keep	ttnn.trace for device forward — 10.8x speedup (Python dispatch was 97% of wall)
293c0c3564	0.00	0.00	crash	slices (2,2,1,1) — block 0 conv_b L1 CB overflow 1.58MB>1.57MB
34263c73b0	70.81	91.49	discard	encoder math LoFi — PCC 0.91 (below 99%); LoFi loses precision even w/ bf16 weights+fp32 acc
787eff6ac6	72.04	99.72	keep	2 command queues — H2D on CQ1 overlaps trace on CQ0 (+1%)
36a30ed431	71.41	99.72	discard	act_block_h_override=32 on block 0 — no improvement
0ed74e2c38	71.90	90.89	discard	bf8 weights on encoder block 0 only — score PCC 0.91 < 99%
33c0baa74b	71.78	99.72	discard	enable_act_double_buffer=True — noise (-0.4%)
054919427c	72.08	99.72	discard	reallocate_halo_output=True — noise (no effect)
065edd0c56	71.53	99.72	discard	BLOCK_SHARDED on encoder block 3 — no benefit at this size
67009b0cdb	71.62	99.72	discard	full_inner_dim=True — noise, no effect
e5e5b7147b	73.65	99.72	keep	final stable benchmark (SP_N_ITER=100) — 12.6x speedup from initial port
49b0c9e2b6	73.71	99.74	keep	(natural, 100-iter) fps_traced=73.71, fps_e2e=16.71, keypoint F1=98.8% at tol=2px/k=500
7d1c3785c0	73.60	99.71	keep	(natural, 100-iter) fps_traced=73.60, fps_match_paper=41.55, fps_e2e=17.03; device softmax, keypoint F1=98.8%
62f112d922	353.31	99.71	keep	(natural, 100-iter) fps_compute_only=353.31, fps_traced=71.81, fps_match_paper=41.95, fps_e2e=17.06; prebuild host input + expose pure-compute metric
36dc9565a3	353.69	99.71	keep	(natural, 100-iter) SP_TRACE_NMS=0 default path; SP_TRACE_NMS=1 device-fold+NMS opt-in code added but net-negative (compute 108 fps vs 353 default) due to 5D permute/DRAM-reshape overhead cancelling host-NMS savings
8c8b473	—	100.00	keep	fused C++ Tensix kernel ttnn.experimental.sp_eq_mul_mask — 1.50x vs ttnn.eq+mul composed (0.184ms vs 0.276ms/iter on 1x1x307200x32 bf16); byte-identical to torch ref across match rates 0..100%
da62f38	355.39	99.71	keep	re-measured on fresh tt-metal build (w/ sp_eq_mul_mask kernel registered): fps_compute_only=355.39, fps_traced=73.63, fps_match_paper=41.62, fps_e2e=17.00 (natural); sample.png regenerated
nms_close	85.59	99.71	keep	(natural, 100-iter, SP_TRACE_NMS=1) sp_eq_mul_mask integrated into _device_fold_and_nms; closes compare+mask on device + on-device ch0 slice shrinks D2H 32x. fps_compute_only=85.59, fps_traced=44.53, fps_match_paper=30.01, fps_e2e=24.11; F1 unchanged 98.80%. e2e 17.00->24.11 (+41%); trace now does fold+max_pool+fused mask (~7ms extra) which absorbs the 36ms host simple_nms.
b989a23	355.38	99.71	keep	(legacy regression, p150a 2026-09-13, SP_N_ITER=100, TT_FUSED unset/0, run_benchmark.sh on the v0.78 tree) fps_compute_only=355.38, fps_traced=97.24 (dual-CQ H2D), fps_e2e=26.42; score PCC 0.997109, desc PCC 0.999083, recall/precision/F1 0.9820/0.9940/0.98796 -- unchanged vs da62f38
fused_trace	—	99.71	keep	(TT_FUSED=1 TT_FUSED_STAGES="", trace-only, natural) fused_h2d_plus_trace_ms=10.27, fused_forward_ms=12.14, fused_postprocess_ms=28.3 (host NMS); PCC/F1 = legacy; eager==traced
fused_wide	—	99.71	keep	(+wide: 64-byte-page upload + in-trace reshape) fused_h2d_plus_trace_ms=3.47 (-6.8 ms: 2-byte-page H2D hypothesis confirmed), fused_forward_ms=5.02; exact
fused_nms	—	99.71	keep	(+nms: NMS-T standard-op chain) fused_nms_map_mismatches=0, fused_h2d_plus_trace_ms=3.97 (+0.50 ms device), fused_forward_ms=5.37, fused_postprocess_ms=1.37 (was 28.3); F1 unchanged
fused_rms	—	99.71	keep	(+rms: rms_norm L2, HiFi4/no-approx/fp32-acc, gamma 1/16) desc PCC 0.999083->0.999085, descriptor_norm_max_dev 0.00488->0.00259, +0.01 ms
fused_all	—	99.71	keep	(+rm = all stages wide,nms,rms,rm; natural, 50-iter) fused_h2d_plus_trace_ms=3.99, fused_forward_ms=4.89, fused_postprocess_ms=1.74; score PCC 0.997109, desc PCC 0.999085, F1 0.98796; served in the shipped image (50 warm requests, medians): device_forward 5.28 ms, postprocess 1.29, total 24.71 (legacy 12.37 / 26.49 / 56.80); keypoints+scores identical to legacy server -> TT_FUSED default ON
